{"events":[{"context":{"packet":{"artifact":{"status":"persisted"},"delivery_issue_urls":["https://example.invalid/issues/1"]},"persisted":{"validated_delivery_spec_digest":"sha256:1111111111111111111111111111111111111111111111111111111111111111"}},"current_node":"research","event":"RESEARCH_PACKET","expected":{"disposition":"accepted","target_node":"implementation","transition_id":"research-approved"},"id":"research-approved"},{"context":{"live":{"pr_head_sha":"aaaaaaaaaaaaaaaaaaaaaaaaaaaaaaaaaaaaaaaa"},"packet":{"artifact":{"status":"persisted"},"pr_head_sha":"bbbbbbbbbbbbbbbbbbbbbbbbbbbbbbbbbbbbbbbb"}},"current_node":"implementation","event":"IMPLEMENTATION_PACKET","expected":{"disposition":"rejected","error_code":"guard-rejected"},"id":"stale-head-rejected"},{"context":{},"current_node":"implementation","event":"FLOW_BLOCKED","expected":{"disposition":"accepted","target_node":"blocked","transition_id":"lane-blocked"},"id":"lane-blocked"},{"context":{"resume_node":"implementation"},"current_node":"blocked","event":"RESUME_AUTHORIZED","expected":{"disposition":"accepted","target_node":"implementation","transition_id":"resume"},"id":"lane-resumed"},{"context":{},"current_node":"implementation","event":"UNKNOWN_EVENT","expected":{"disposition":"unsupported","error_code":"unsupported-event"},"id":"unknown-event"}],"execution":{"environment_contract_sha256":"sha256:2222222222222222222222222222222222222222222222222222222222222222","kind":"protocol-replay","model":"non-agent","reasoning":"none","time_budget_seconds":300,"trial_id":"trial-one"},"fixture":{"content_sha256":"sha256:3333333333333333333333333333333333333333333333333333333333333333","id":"protocol-replay-v1","version":1},"initial_repository_sha":"4444444444444444444444444444444444444444","initial_state":{"data":{"review_fix_cycles":0},"node":"research"},"schema_version":1,"suite":{"content_sha256":"sha256:5555555555555555555555555555555555555555555555555555555555555555","id":"protocol-evaluation-v1","version":1},"trace_id":"protocol-replay-core","trace_version":1}
